<?xml version="1.0" encoding="UTF-8"?>
<!--
  Copyright (c) 2008 Seva Safris

  Permission is hereby granted, free of charge, to any person obtaining a copy
  of this software and associated documentation files (the "Software"), to deal
  in the Software without restriction, including without limitation the rights
  to use, copy, modify, merge, publish, distribute, sublicense, and/or sell
  copies of the Software, and to permit persons to whom the Software is
  furnished to do so, subject to the following conditions:

  The above copyright notice and this permission notice shall be included in
  all copies or substantial portions of the Software.

  You should have received a copy of The MIT License (MIT) along with this
  program. If not, see <http://opensource.org/licenses/MIT/>.
-->

<na:root
  xmlns:na="http://xml.safris.org/schema/binding/test/unit/name.xsd"
  xmlns:xsi="http://www.w3.org/2001/XMLSchema-instance"
  xsi:schemaLocation="http://xml.safris.org/schema/binding/test/unit/name.xsd ../../xsd/unit/name.xsd">
  <na:name>
    <na:name na:Name="false" na:name="true">
      <na:name>
        <na:name na:Name="true" na:name="false">
          <na:name>
            <na:name
              xsi:nil="true" name="stuff" Name="more"/>
          </na:name>
        </na:name>
      </na:name>
    </na:name>
  </na:name>
  <na:name na:Name="false" na:name="true">
    <na:name>
      <na:name na:Name="true" na:name="false" name="what" Name="when">
        <na:name
          xsi:nil="true"/>
      </na:name>
    </na:name>
  </na:name>
  <na:name>
    <na:name na:Name="false" na:name="true" name="where" Name="here">
      <na:name
        xsi:nil="true"/>
    </na:name>
  </na:name>
  <na:Name na:Name="true" na:name="false" name="hi" Name="hello" xsi:nil="false">
    <na:name>
      <na:name na:Name="false" na:name="true">
        <na:name>
          <na:name
            xsi:nil="true" name="nill" Name="yup"/>
        </na:name>
      </na:name>
    </na:name>
    <na:name>
      <na:name
        xsi:nil="true" name="who" Name="ever" na:Name="true" na:name="false"/>
    </na:name>
  </na:Name>
  <na:Name name="really" Name="yup" na:Name="true" na:name="true">
    <na:name>
      <na:name name="my" Name="world" na:Name="true" na:name="true">
        <na:name
          xsi:nil="true"/>
      </na:name>
    </na:name>
    <na:name
      xsi:nil="true"/>
  </na:Name>
</na:root>